{
  "$schema": "https://json-schema.org/draft/2020-12/schema",
  "$id": "https://onomasticon.dev/schema/lexicon.schema.json",
  "title": "Onomasticon Lexicon",
  "description": "A reusable word list referenced by one or more pack slots via lexiconRefs. Kept separate from packs so a lexicon (e.g. 'common-western-given') can be shared across genres and lazy-loaded independently of pack metadata.",
  "type": "object",
  "required": ["schemaVersion", "id", "entries"],
  "additionalProperties": false,
  "properties": {
    "schemaVersion": {
      "const": 1,
      "description": "Bump only on breaking changes to this schema."
    },
    "id": {
      "type": "string",
      "pattern": "^[a-z0-9]+(?:-[a-z0-9]+)*$",
      "description": "Referenced by a pack's lexiconRefs map, e.g. 'elven-given'."
    },
    "label": { "type": "string" },
    "tags": { "type": "array", "items": { "type": "string" } },
    "entries": {
      "type": "array",
      "minItems": 1,
      "items": {
        "type": "object",
        "required": ["value"],
        "additionalProperties": false,
        "properties": {
          "value": { "type": "string", "minLength": 1 },
          "variants": {
            "type": "array",
            "items": { "type": "string" },
            "minItems": 1,
            "description": "Open vocabulary, e.g. 'masc'/'fem'/'neutral' or any pack-defined key. Omit entirely to match any variant filter."
          },
          "weight": {
            "type": "number",
            "exclusiveMinimum": 0,
            "default": 1,
            "description": "Relative selection weight among entries matching the requested variant."
          },
          "tags": {
            "type": "array",
            "items": { "type": "string" },
            "description": "Optional finer-grained filtering (region, era, etc.) beyond variant."
          }
        }
      }
    }
  }
}
