{
  "schemaVersion": 1,
  "id": "nomad-family",
  "tags": ["sci-fi", "nomad"],
  "entries": [
    { "value": "Thessyn" },
    { "value": "Korvath" },
    { "value": "Ashdrift" },
    { "value": "Nallory" },
    { "value": "Brakwin" },
    { "value": "Ostvane" },
    { "value": "Quillith" },
    { "value": "Delcrest" },
    { "value": "Fenrath" },
    { "value": "Ivarn" },
    { "value": "Kestwick" },
    { "value": "Lorvane" },
    { "value": "Maddox" },
    { "value": "Norvin" },
    { "value": "Ostrey" },
    { "value": "Pellrath" },
    { "value": "Quorven" },
    { "value": "Rendal" },
    { "value": "Torvane" },
    { "value": "Ulrath" },
    { "value": "Vexley" },
    { "value": "Wrenmoor" },
    { "value": "Yorlath" },
    { "value": "Zephrin" },
    { "value": "Brennik" },
    { "value": "Coldrift" },
    { "value": "Halveth" },
    { "value": "Ismarrow" }
  ]
}
