{
  "schemaVersion": 1,
  "id": "latin-family",
  "tags": ["modern", "latin-american"],
  "entries": [
    { "value": "Garcia" },
    { "value": "Rodriguez" },
    { "value": "Martinez" },
    { "value": "Hernandez" },
    { "value": "Lopez" },
    { "value": "Gonzalez" },
    { "value": "Perez" },
    { "value": "Sanchez" },
    { "value": "Ramirez" },
    { "value": "Torres" },
    { "value": "Flores" },
    { "value": "Rivera" },
    { "value": "Gomez" },
    { "value": "Diaz" },
    { "value": "Cruz" },
    { "value": "Morales" },
    { "value": "Ortiz" },
    { "value": "Gutierrez" },
    { "value": "Chavez" },
    { "value": "Ramos" },
    { "value": "Reyes" },
    { "value": "Jimenez" },
    { "value": "Castillo" },
    { "value": "Vargas" },
    { "value": "Romero" },
    { "value": "Alvarez" },
    { "value": "Medina" },
    { "value": "Aguilar" },
    { "value": "Mendoza" },
    { "value": "Ruiz" },
    { "value": "Nunez" },
    { "value": "Herrera" },
    { "value": "Guerrero" },
    { "value": "Rojas" },
    { "value": "Salazar" },
    { "value": "Vega" },
    { "value": "Fuentes" },
    { "value": "Contreras" },
    { "value": "Silva" },
    { "value": "Cabrera" },
    { "value": "Delgado" },
    { "value": "Padilla" },
    { "value": "Sandoval" },
    { "value": "Vazquez" },
    { "value": "Castro" },
    { "value": "Ortega" },
    { "value": "Rios" },
    { "value": "Molina" },
    { "value": "Aguirre" },
    { "value": "Cervantes" },
    { "value": "Cortez" },
    { "value": "Espinoza" },
    { "value": "Juarez" },
    { "value": "Luna" },
    { "value": "Marquez" },
    { "value": "Soto" }
  ]
}
