{
  "schemaVersion": 1,
  "id": "western-moniker",
  "tags": ["western"],
  "entries": [
    { "value": "Doc" },
    { "value": "Reb" },
    { "value": "Preacher" },
    { "value": "Ace" },
    { "value": "Deuce" },
    { "value": "Whiskey" },
    { "value": "Snake" },
    { "value": "Cactus" },
    { "value": "Rattler" },
    { "value": "Boots" },
    { "value": "Gunner" },
    { "value": "Ranger" },
    { "value": "Sundance" },
    { "value": "Shotgun" },
    { "value": "Bronco" },
    { "value": "Coyote" },
    { "value": "Grizzly" },
    { "value": "Buckshot" },
    { "value": "Trigger" },
    { "value": "Maverick" },
    { "value": "Rusty" },
    { "value": "Scout" },
    { "value": "Drifter" },
    { "value": "Lonestar" },
    { "value": "Butch" },
    { "value": "Reno" },
    { "value": "Deadeye" },
    { "value": "Tumbleweed" },
    { "value": "Sarge" },
    { "value": "Marshal" },
    { "value": "Copperhead" },
    { "value": "Sidewinder" },
    { "value": "Blackjack" },
    { "value": "Roughrider" },
    { "value": "Vaquero" },
    { "value": "Duke" },
    { "value": "Kid" },
    { "value": "Widowmaker" },
    { "value": "Undertaker" },
    { "value": "Deacon" },
    { "value": "Judge" },
    { "value": "Ironside" },
    { "value": "Two-Bit" },
    { "value": "Ghost" },
    { "value": "Hawkeye" },
    { "value": "Renegade" },
    { "value": "Stovepipe" },
    { "value": "Longshot" }
  ]
}
