{
  "schemaVersion": 1,
  "id": "latin-given",
  "tags": ["modern", "latin-american"],
  "entries": [
    { "value": "Carlos", "variants": ["masc"] },
    { "value": "Javier", "variants": ["masc"] },
    { "value": "Miguel", "variants": ["masc"] },
    { "value": "Diego", "variants": ["masc"] },
    { "value": "Alejandro", "variants": ["masc"] },
    { "value": "Rafael", "variants": ["masc"] },
    { "value": "Fernando", "variants": ["masc"] },
    { "value": "Ricardo", "variants": ["masc"] },
    { "value": "Eduardo", "variants": ["masc"] },
    { "value": "Manuel", "variants": ["masc"] },
    { "value": "Luis", "variants": ["masc"] },
    { "value": "Jorge", "variants": ["masc"] },
    { "value": "Pablo", "variants": ["masc"] },
    { "value": "Andres", "variants": ["masc"] },
    { "value": "Sergio", "variants": ["masc"] },
    { "value": "Gustavo", "variants": ["masc"] },
    { "value": "Emilio", "variants": ["masc"] },
    { "value": "Mateo", "variants": ["masc"] },
    { "value": "Santiago", "variants": ["masc"] },
    { "value": "Rodrigo", "variants": ["masc"] },
    { "value": "Ignacio", "variants": ["masc"] },
    { "value": "Esteban", "variants": ["masc"] },
    { "value": "Hector", "variants": ["masc"] },
    { "value": "Maria", "variants": ["fem"] },
    { "value": "Sofia", "variants": ["fem"] },
    { "value": "Valentina", "variants": ["fem"] },
    { "value": "Camila", "variants": ["fem"] },
    { "value": "Isabella", "variants": ["fem"] },
    { "value": "Lucia", "variants": ["fem"] },
    { "value": "Gabriela", "variants": ["fem"] },
    { "value": "Daniela", "variants": ["fem"] },
    { "value": "Carolina", "variants": ["fem"] },
    { "value": "Adriana", "variants": ["fem"] },
    { "value": "Fernanda", "variants": ["fem"] },
    { "value": "Alejandra", "variants": ["fem"] },
    { "value": "Paulina", "variants": ["fem"] },
    { "value": "Renata", "variants": ["fem"] },
    { "value": "Ximena", "variants": ["fem"] },
    { "value": "Mariana", "variants": ["fem"] },
    { "value": "Beatriz", "variants": ["fem"] },
    { "value": "Rosa", "variants": ["fem"] },
    { "value": "Elena", "variants": ["fem"] },
    { "value": "Teresa", "variants": ["fem"] },
    { "value": "Victoria", "variants": ["fem"] },
    { "value": "Luciana", "variants": ["fem"] }
  ]
}
