{
  "schemaVersion": 1,
  "id": "spacer-family",
  "tags": ["sci-fi"],
  "entries": [
    { "value": "Ostrenko" },
    { "value": "Callas" },
    { "value": "Wren" },
    { "value": "Idegawa" },
    { "value": "Vantrell" },
    { "value": "Kestrel" },
    { "value": "Orimoto" },
    { "value": "Draven" },
    { "value": "Ferro" },
    { "value": "Calvez" },
    { "value": "Sundstrom" },
    { "value": "Okonkwo" },
    { "value": "Vasilenko" },
    { "value": "Marchetti" },
    { "value": "Delgado" },
    { "value": "Whitlock" },
    { "value": "Ashcombe" },
    { "value": "Renfrew" },
    { "value": "Solheim" },
    { "value": "Kade" },
    { "value": "Yuen" },
    { "value": "Petrikova" },
    { "value": "Danvers" },
    { "value": "Ostrand" },
    { "value": "Voss" },
    { "value": "Brennick" },
    { "value": "Talvera" },
    { "value": "Corvain" },
    { "value": "Ostrevik" },
    { "value": "Vantrys" },
    { "value": "Kestrion" },
    { "value": "Draveth" },
    { "value": "Ferrow" },
    { "value": "Ashvern" },
    { "value": "Corvaine" },
    { "value": "Sundrask" },
    { "value": "Vosric" },
    { "value": "Talveron" },
    { "value": "Renwick" },
    { "value": "Ostmar" },
    { "value": "Ilvexis" },
    { "value": "Brakstone" },
    { "value": "Chandran" },
    { "value": "Mehta" },
    { "value": "Haddad" },
    { "value": "Karimi" },
    { "value": "Santoso" },
    { "value": "Truong" },
    { "value": "Lindqvist" },
    { "value": "Haugen" },
    { "value": "Mensah" },
    { "value": "Abara" },
    { "value": "Watanabe" },
    { "value": "Kwan" },
    { "value": "Novak" },
    { "value": "Dubois" }
  ]
}
