{
  "schemaVersion": 1,
  "id": "elven-given",
  "tags": ["fantasy", "elven"],
  "entries": [
    { "value": "Thalvir", "variants": ["masc"] },
    { "value": "Ondrel", "variants": ["masc"] },
    { "value": "Caelith", "variants": ["masc"] },
    { "value": "Faelar", "variants": ["masc"] },
    { "value": "Threnvir", "variants": ["masc"] },
    { "value": "Aerendil", "variants": ["masc"] },
    { "value": "Caladris", "variants": ["masc"] },
    { "value": "Voreth", "variants": ["masc"] },
    { "value": "Isilmar", "variants": ["masc"] },
    { "value": "Thornael", "variants": ["masc"] },
    { "value": "Cyrendal", "variants": ["masc"] },
    { "value": "Maelgrim", "variants": ["masc"] },
    { "value": "Sylvaeth", "variants": ["masc"] },
    { "value": "Oriveth", "variants": ["masc"] },
    { "value": "Nethril", "variants": ["masc"] },
    { "value": "Aldrenor", "variants": ["masc"] },
    { "value": "Elarion", "variants": ["masc"] },
    { "value": "Vaelith", "variants": ["masc"] },
    { "value": "Thandor", "variants": ["masc"] },
    { "value": "Caerion", "variants": ["masc"] },
    { "value": "Silmareth", "variants": ["masc"] },
    { "value": "Rhendil", "variants": ["masc"] },
    { "value": "Aeliron", "variants": ["masc"] },
    { "value": "Nolwyth", "variants": ["masc"] },
    { "value": "Ithilmar", "variants": ["masc"] },
    { "value": "Ferendil", "variants": ["masc"] },
    { "value": "Caelendor", "variants": ["masc"] },
    { "value": "Ashwyn", "variants": ["masc"] },
    { "value": "Voreneth", "variants": ["masc"] },
    { "value": "Lorathir", "variants": ["masc"] },
    { "value": "Quendris", "variants": ["masc"] },
    { "value": "Sarethil", "variants": ["masc"] },
    { "value": "Elowen", "variants": ["fem"] },
    { "value": "Sarenith", "variants": ["fem"] },
    { "value": "Nyleth", "variants": ["fem"] },
    { "value": "Lyrissa", "variants": ["fem"] },
    { "value": "Aelenya", "variants": ["fem"] },
    { "value": "Vaeril", "variants": ["fem"] },
    { "value": "Thessaly", "variants": ["fem"] },
    { "value": "Nimriel", "variants": ["fem"] },
    { "value": "Sylwyn", "variants": ["fem"] },
    { "value": "Aerith", "variants": ["fem"] },
    { "value": "Caldriel", "variants": ["fem"] },
    { "value": "Thendara", "variants": ["fem"] },
    { "value": "Wrenella", "variants": ["fem"] },
    { "value": "Amareth", "variants": ["fem"] },
    { "value": "Isolwen", "variants": ["fem"] },
    { "value": "Faerith", "variants": ["fem"] },
    { "value": "Miriel", "variants": ["fem"] },
    { "value": "Elenwyn", "variants": ["fem"] },
    { "value": "Naethril", "variants": ["fem"] },
    { "value": "Ysoleth", "variants": ["fem"] },
    { "value": "Caerwen", "variants": ["fem"] },
    { "value": "Thalindra", "variants": ["fem"] },
    { "value": "Ilyanna", "variants": ["fem"] },
    { "value": "Serevyn", "variants": ["fem"] },
    { "value": "Aeliana", "variants": ["fem"] },
    { "value": "Vyrenna", "variants": ["fem"] },
    { "value": "Nimwen", "variants": ["fem"] },
    { "value": "Ashariel", "variants": ["fem"] },
    { "value": "Quorwyn", "variants": ["fem"] },
    { "value": "Lethiel", "variants": ["fem"] },
    { "value": "Faendra", "variants": ["fem"] },
    { "value": "Orindiel", "variants": ["fem"] },
    { "value": "Ashan", "variants": ["masc", "fem", "neutral"] },
    { "value": "Ilyeth", "variants": ["masc", "fem", "neutral"] },
    { "value": "Ithran", "variants": ["neutral"] },
    { "value": "Corveth", "variants": ["neutral"] },
    { "value": "Selwyn", "variants": ["neutral"] },
    { "value": "Thaelin", "variants": ["neutral"] },
    { "value": "Anvarel", "variants": ["neutral"] },
    { "value": "Cyrwen", "variants": ["neutral"] },
    { "value": "Lorendal", "variants": ["neutral"] },
    { "value": "Miravel", "variants": ["neutral"] },
    { "value": "Quorith", "variants": ["neutral"] },
    { "value": "Sennoval", "variants": ["neutral"] },
    { "value": "Talwyn", "variants": ["neutral"] },
    { "value": "Ilvaen", "variants": ["masc", "fem", "neutral"] },
    { "value": "Threnna", "variants": ["masc", "fem", "neutral"] },
    { "value": "Vaelor", "variants": ["neutral"] },
    { "value": "Cyneth", "variants": ["neutral"] },
    { "value": "Orimar", "variants": ["neutral"] },
    { "value": "Thassil", "variants": ["neutral"] },
    { "value": "Lorevyn", "variants": ["neutral"] },
    { "value": "Nendris", "variants": ["neutral"] },
    { "value": "Aerlyn", "variants": ["neutral"] },
    { "value": "Sylmir", "variants": ["neutral"] },
    { "value": "Quenna", "variants": ["neutral"] },
    { "value": "Farwyn", "variants": ["neutral"] },
    { "value": "Ithrenn", "variants": ["neutral"] }
  ]
}
