{
  "schemaVersion": 1,
  "id": "slavic-given",
  "tags": ["modern", "slavic"],
  "entries": [
    { "value": "Ivan", "variants": ["masc"] },
    { "value": "Pyotr", "variants": ["masc"] },
    { "value": "Mikhail", "variants": ["masc"] },
    { "value": "Dmitri", "variants": ["masc"] },
    { "value": "Sergei", "variants": ["masc"] },
    { "value": "Nikolai", "variants": ["masc"] },
    { "value": "Boris", "variants": ["masc"] },
    { "value": "Anton", "variants": ["masc"] },
    { "value": "Vladimir", "variants": ["masc"] },
    { "value": "Yuri", "variants": ["masc"] },
    { "value": "Andrei", "variants": ["masc"] },
    { "value": "Viktor", "variants": ["masc"] },
    { "value": "Roman", "variants": ["masc"] },
    { "value": "Igor", "variants": ["masc"] },
    { "value": "Oleg", "variants": ["masc"] },
    { "value": "Stanislav", "variants": ["masc"] },
    { "value": "Leonid", "variants": ["masc"] },
    { "value": "Maksim", "variants": ["masc"] },
    { "value": "Denis", "variants": ["masc"] },
    { "value": "Artem", "variants": ["masc"] },
    { "value": "Ruslan", "variants": ["masc"] },
    { "value": "Vadim", "variants": ["masc"] },
    { "value": "Konstantin", "variants": ["masc"] },
    { "value": "Alexander", "variants": ["masc"] },
    { "value": "Alexei", "variants": ["masc"] },
    { "value": "Grigori", "variants": ["masc"] },
    { "value": "Fyodor", "variants": ["masc"] },
    { "value": "Pavel", "variants": ["masc"] },
    { "value": "Vasili", "variants": ["masc"] },
    { "value": "Semyon", "variants": ["masc"] },
    { "value": "Timofei", "variants": ["masc"] },
    { "value": "Arkady", "variants": ["masc"] },
    { "value": "Zakhar", "variants": ["masc"] },
    { "value": "Matvei", "variants": ["masc"] },
    { "value": "Kirill", "variants": ["masc"] },
    { "value": "Vitaly", "variants": ["masc"] },
    { "value": "Gennady", "variants": ["masc"] },
    { "value": "Yaroslav", "variants": ["masc"] },
    { "value": "Anatoly", "variants": ["masc"] },
    { "value": "Rostislav", "variants": ["masc"] },
    { "value": "Bogdan", "variants": ["masc"] },
    { "value": "Nikita", "variants": ["masc"] },
    { "value": "Timur", "variants": ["masc"] },
    { "value": "Stepan", "variants": ["masc"] },
    { "value": "Iosif", "variants": ["masc"] },
    { "value": "Lev", "variants": ["masc"] },
    { "value": "Yelena", "variants": ["fem"] },
    { "value": "Irina", "variants": ["fem"] },
    { "value": "Natasha", "variants": ["fem"] },
    { "value": "Svetlana", "variants": ["fem"] },
    { "value": "Olga", "variants": ["fem"] },
    { "value": "Tatiana", "variants": ["fem"] },
    { "value": "Anastasia", "variants": ["fem"] },
    { "value": "Ekaterina", "variants": ["fem"] },
    { "value": "Marina", "variants": ["fem"] },
    { "value": "Ksenia", "variants": ["fem"] },
    { "value": "Larisa", "variants": ["fem"] },
    { "value": "Galina", "variants": ["fem"] },
    { "value": "Vera", "variants": ["fem"] },
    { "value": "Nadia", "variants": ["fem"] },
    { "value": "Lyudmila", "variants": ["fem"] },
    { "value": "Oksana", "variants": ["fem"] },
    { "value": "Polina", "variants": ["fem"] },
    { "value": "Yulia", "variants": ["fem"] },
    { "value": "Zoya", "variants": ["fem"] },
    { "value": "Alina", "variants": ["fem"] },
    { "value": "Vasilisa", "variants": ["fem"] },
    { "value": "Darya", "variants": ["fem"] },
    { "value": "Aleksandra", "variants": ["fem"] },
    { "value": "Anna", "variants": ["fem"] },
    { "value": "Mariya", "variants": ["fem"] },
    { "value": "Elizaveta", "variants": ["fem"] },
    { "value": "Sofia", "variants": ["fem"] },
    { "value": "Varvara", "variants": ["fem"] },
    { "value": "Uliana", "variants": ["fem"] },
    { "value": "Arina", "variants": ["fem"] },
    { "value": "Yeva", "variants": ["fem"] },
    { "value": "Kristina", "variants": ["fem"] },
    { "value": "Albina", "variants": ["fem"] },
    { "value": "Zinaida", "variants": ["fem"] },
    { "value": "Taisiya", "variants": ["fem"] },
    { "value": "Yevgenia", "variants": ["fem"] },
    { "value": "Antonina", "variants": ["fem"] },
    { "value": "Raisa", "variants": ["fem"] },
    { "value": "Lidiya", "variants": ["fem"] },
    { "value": "Klavdiya", "variants": ["fem"] },
    { "value": "Serafima", "variants": ["fem"] },
    { "value": "Nadezhda", "variants": ["fem"] },
    { "value": "Zlata", "variants": ["fem"] },
    { "value": "Miroslava", "variants": ["fem"] }
  ]
}
