{
  "schemaVersion": 1,
  "id": "slavic-family",
  "tags": ["modern", "slavic"],
  "entries": [
    { "value": "Volkov" },
    { "value": "Sokolova" },
    { "value": "Petrov" },
    { "value": "Morozova" },
    { "value": "Kuznetsov" },
    { "value": "Kuznetsova" },
    { "value": "Ivanov" },
    { "value": "Ivanova" },
    { "value": "Smirnov" },
    { "value": "Smirnova" },
    { "value": "Popov" },
    { "value": "Popova" },
    { "value": "Vasiliev" },
    { "value": "Vasilieva" },
    { "value": "Fedorov" },
    { "value": "Fedorova" },
    { "value": "Novikov" },
    { "value": "Novikova" },
    { "value": "Sorokin" },
    { "value": "Sorokina" },
    { "value": "Pavlov" },
    { "value": "Pavlova" },
    { "value": "Belov" },
    { "value": "Belova" },
    { "value": "Orlov" },
    { "value": "Orlova" },
    { "value": "Zaitsev" },
    { "value": "Zaitseva" }
  ]
}
