{
  "schemaVersion": 1,
  "id": "dwarven-given",
  "tags": ["fantasy", "dwarven"],
  "entries": [
    { "value": "Thorik", "variants": ["masc"] },
    { "value": "Baldrek", "variants": ["masc"] },
    { "value": "Grundar", "variants": ["masc"] },
    { "value": "Oskvir", "variants": ["masc"] },
    { "value": "Durnan", "variants": ["masc"] },
    { "value": "Halgrim", "variants": ["masc"] },
    { "value": "Voldrek", "variants": ["masc"] },
    { "value": "Brogun", "variants": ["masc"] },
    { "value": "Kazrek", "variants": ["masc"] },
    { "value": "Fendrik", "variants": ["masc"] },
    { "value": "Marnok", "variants": ["masc"] },
    { "value": "Ulrik", "variants": ["masc"] },
    { "value": "Bregnar", "variants": ["masc"] },
    { "value": "Thundar", "variants": ["masc"] },
    { "value": "Skalgrim", "variants": ["masc"] },
    { "value": "Dornek", "variants": ["masc"] },
    { "value": "Borgrim", "variants": ["masc"] },
    { "value": "Kaldrek", "variants": ["masc"] },
    { "value": "Thrainor", "variants": ["masc"] },
    { "value": "Vulmar", "variants": ["masc"] },
    { "value": "Ragnok", "variants": ["masc"] },
    { "value": "Sturmin", "variants": ["masc"] },
    { "value": "Drogvar", "variants": ["masc"] },
    { "value": "Helgrim", "variants": ["masc"] },
    { "value": "Warvek", "variants": ["masc"] },
    { "value": "Brundin", "variants": ["masc"] },
    { "value": "Ostgar", "variants": ["masc"] },
    { "value": "Falkrek", "variants": ["masc"] },
    { "value": "Nordvin", "variants": ["masc"] },
    { "value": "Grimbold", "variants": ["masc"] },
    { "value": "Kettil", "variants": ["masc"] },
    { "value": "Andvar", "variants": ["masc"] },
    { "value": "Brenna", "variants": ["fem"] },
    { "value": "Hilda", "variants": ["fem"] },
    { "value": "Gerdrun", "variants": ["fem"] },
    { "value": "Astrid", "variants": ["fem"] },
    { "value": "Freygra", "variants": ["fem"] },
    { "value": "Solveig", "variants": ["fem"] },
    { "value": "Bryndis", "variants": ["fem"] },
    { "value": "Ketla", "variants": ["fem"] },
    { "value": "Ragna", "variants": ["fem"] },
    { "value": "Ulfrun", "variants": ["fem"] },
    { "value": "Thyra", "variants": ["fem"] },
    { "value": "Vigdis", "variants": ["fem"] },
    { "value": "Drifa", "variants": ["fem"] },
    { "value": "Runa", "variants": ["fem"] },
    { "value": "Signy", "variants": ["fem"] },
    { "value": "Helka", "variants": ["fem"] },
    { "value": "Brynhild", "variants": ["fem"] },
    { "value": "Gudrun", "variants": ["fem"] },
    { "value": "Ingrid", "variants": ["fem"] },
    { "value": "Sigrun", "variants": ["fem"] },
    { "value": "Frida", "variants": ["fem"] },
    { "value": "Hjordis", "variants": ["fem"] },
    { "value": "Ranveig", "variants": ["fem"] },
    { "value": "Alvdis", "variants": ["fem"] },
    { "value": "Torhild", "variants": ["fem"] },
    { "value": "Gerda", "variants": ["fem"] },
    { "value": "Svanhild", "variants": ["fem"] },
    { "value": "Ylva", "variants": ["fem"] },
    { "value": "Dagny", "variants": ["fem"] },
    { "value": "Freydis", "variants": ["fem"] },
    { "value": "Halla", "variants": ["fem"] },
    { "value": "Unnveig", "variants": ["fem"] },
    { "value": "Skarn", "variants": ["neutral"] },
    { "value": "Grimna", "variants": ["neutral"] },
    { "value": "Vundr", "variants": ["neutral"] },
    { "value": "Halka", "variants": ["neutral"] },
    { "value": "Brekk", "variants": ["neutral"] },
    { "value": "Ostvin", "variants": ["neutral"] },
    { "value": "Kelgar", "variants": ["neutral"] },
    { "value": "Rundis", "variants": ["neutral"] },
    { "value": "Warnik", "variants": ["neutral"] },
    { "value": "Ymgrid", "variants": ["neutral"] },
    { "value": "Dolgrim", "variants": ["neutral"] },
    { "value": "Fenrik", "variants": ["neutral"] },
    { "value": "Storna", "variants": ["neutral"] },
    { "value": "Grombar", "variants": ["neutral"] },
    { "value": "Skjold", "variants": ["neutral"] },
    { "value": "Varnik", "variants": ["neutral"] },
    { "value": "Hollvik", "variants": ["neutral"] },
    { "value": "Brandis", "variants": ["neutral"] },
    { "value": "Kettvar", "variants": ["neutral"] },
    { "value": "Yrnvik", "variants": ["neutral"] },
    { "value": "Dvalin", "variants": ["neutral"] },
    { "value": "Norrik", "variants": ["neutral"] },
    { "value": "Thistad", "variants": ["neutral"] },
    { "value": "Skarvin", "variants": ["neutral"] },
    { "value": "Brimgar", "variants": ["neutral"] },
    { "value": "Haldrun", "variants": ["neutral"] }
  ]
}
