{
  "schemaVersion": 1,
  "id": "nomad-given",
  "tags": ["sci-fi", "nomad"],
  "entries": [
    { "value": "Rax", "variants": ["masc"] },
    { "value": "Kellin", "variants": ["masc"] },
    { "value": "Dray", "variants": ["masc"] },
    { "value": "Corym", "variants": ["masc"] },
    { "value": "Idris", "variants": ["masc"] },
    { "value": "Kesh", "variants": ["masc"] },
    { "value": "Bram", "variants": ["masc"] },
    { "value": "Tovan", "variants": ["masc"] },
    { "value": "Ashek", "variants": ["masc"] },
    { "value": "Ruven", "variants": ["masc"] },
    { "value": "Colm", "variants": ["masc"] },
    { "value": "Estan", "variants": ["masc"] },
    { "value": "Vrey", "variants": ["masc"] },
    { "value": "Danix", "variants": ["masc"] },
    { "value": "Sorin", "variants": ["masc"] },
    { "value": "Halven", "variants": ["masc"] },
    { "value": "Shai", "variants": ["fem"] },
    { "value": "Ilona", "variants": ["fem"] },
    { "value": "Verra", "variants": ["fem"] },
    { "value": "Nyssa", "variants": ["fem"] },
    { "value": "Bryn", "variants": ["fem"] },
    { "value": "Kessa", "variants": ["fem"] },
    { "value": "Odalys", "variants": ["fem"] },
    { "value": "Thera", "variants": ["fem"] },
    { "value": "Ravyn", "variants": ["fem"] },
    { "value": "Ilse", "variants": ["fem"] },
    { "value": "Sonn", "variants": ["fem"] },
    { "value": "Vashka", "variants": ["fem"] },
    { "value": "Corel", "variants": ["fem"] },
    { "value": "Anessa", "variants": ["fem"] },
    { "value": "Drell", "variants": ["fem"] },
    { "value": "Ysolt", "variants": ["fem"] },
    { "value": "Rho", "variants": ["neutral"] },
    { "value": "Vantha", "variants": ["neutral"] },
    { "value": "Ceres", "variants": ["neutral"] },
    { "value": "Ilo", "variants": ["neutral"] },
    { "value": "Dask", "variants": ["neutral"] },
    { "value": "Yara", "variants": ["neutral"] },
    { "value": "Winn", "variants": ["neutral"] },
    { "value": "Ostra", "variants": ["neutral"] },
    { "value": "Fenn", "variants": ["neutral"] },
    { "value": "Talic", "variants": ["neutral"] },
    { "value": "Drav", "variants": ["neutral"] },
    { "value": "Onyx", "variants": ["neutral"] },
    { "value": "Ren", "variants": ["neutral"] }
  ]
}
