{
  "schemaVersion": 1,
  "id": "dwarven-family",
  "tags": ["fantasy", "dwarven"],
  "entries": [
    { "value": "Ironfist" },
    { "value": "Stonebeard" },
    { "value": "Battlehammer" },
    { "value": "Deepdelve" },
    { "value": "Coppervein" },
    { "value": "Goldforge" },
    { "value": "Steelbrow" },
    { "value": "Emberforge" },
    { "value": "Rockjaw" },
    { "value": "Frostbeard" },
    { "value": "Anvilheart" },
    { "value": "Grimhollow" },
    { "value": "Bronzeshield" },
    { "value": "Darkforge" },
    { "value": "Silverpick" },
    { "value": "Hammerfall" },
    { "value": "Stormforge" },
    { "value": "Ashbeard" },
    { "value": "Boulderfist" },
    { "value": "Cinderhelm" },
    { "value": "Flintlock" },
    { "value": "Granitehold" },
    { "value": "Ironvein" },
    { "value": "Oakenshield" },
    { "value": "Thunderforge" },
    { "value": "Warforge" },
    { "value": "Blackiron" },
    { "value": "Deeproot" }
  ]
}
