{
  "schemaVersion": 1,
  "id": "western-family",
  "tags": ["western"],
  "entries": [
    { "value": "Carson" },
    { "value": "Walker" },
    { "value": "Hayes" },
    { "value": "McCoy" },
    { "value": "Hollis" },
    { "value": "Mercer" },
    { "value": "Dalton" },
    { "value": "Shaw" },
    { "value": "Wilder" },
    { "value": "Tate" },
    { "value": "Keene" },
    { "value": "Briggs" },
    { "value": "Parker" },
    { "value": "Sutton" },
    { "value": "Laramie" },
    { "value": "Ridge" },
    { "value": "Bennett" },
    { "value": "Hollister" },
    { "value": "Granger" },
    { "value": "Pierce" },
    { "value": "Ransom" },
    { "value": "Garrison" },
    { "value": "Colton" },
    { "value": "Ferris" },
    { "value": "Hardin" },
    { "value": "Slade" },
    { "value": "Rourke" },
    { "value": "Calhoun" },
    { "value": "Winslow" },
    { "value": "Barlow" },
    { "value": "Crockett" },
    { "value": "Sawyer" },
    { "value": "Latimer" },
    { "value": "Savage" },
    { "value": "Flint" },
    { "value": "Cooper" },
    { "value": "Campbell" },
    { "value": "MacDonald" },
    { "value": "Ferguson" },
    { "value": "Kincaid" },
    { "value": "Sterling" },
    { "value": "Holt" },
    { "value": "Whitfield" },
    { "value": "Beaumont" }
  ]
}
