{
  "schemaVersion": 1,
  "id": "western-given",
  "tags": ["western"],
  "entries": [
    { "value": "Wyatt", "variants": ["masc"] },
    { "value": "Jesse", "variants": ["masc", "fem", "neutral"] },
    { "value": "Cole", "variants": ["masc"] },
    { "value": "Boone", "variants": ["masc"] },
    { "value": "Silas", "variants": ["masc"] },
    { "value": "Hank", "variants": ["masc"] },
    { "value": "Mason", "variants": ["masc"] },
    { "value": "Eli", "variants": ["masc", "neutral"] },
    { "value": "Cal", "variants": ["masc"] },
    { "value": "Tex", "variants": ["masc", "neutral"] },
    { "value": "Frank", "variants": ["masc"] },
    { "value": "Walter", "variants": ["masc"] },
    { "value": "Arthur", "variants": ["masc"] },
    { "value": "Albert", "variants": ["masc"] },
    { "value": "Clarence", "variants": ["masc"] },
    { "value": "Zeke", "variants": ["masc"] },
    { "value": "Ezra", "variants": ["masc"] },
    { "value": "Otis", "variants": ["masc"] },
    { "value": "Virgil", "variants": ["masc"] },
    { "value": "Emmett", "variants": ["masc"] },
    { "value": "Riley", "variants": ["neutral"] },
    { "value": "Kit", "variants": ["neutral"] },
    { "value": "Dusty", "variants": ["neutral"] },
    { "value": "Frankie", "variants": ["neutral"] },
    { "value": "Marion", "variants": ["neutral"] },
    { "value": "Lonnie", "variants": ["neutral"] },
    { "value": "Clara", "variants": ["fem"] },
    { "value": "Annie", "variants": ["fem"] },
    { "value": "Belle", "variants": ["fem"] },
    { "value": "Pearl", "variants": ["fem"] },
    { "value": "Hazel", "variants": ["fem"] },
    { "value": "Ruby", "variants": ["fem"] },
    { "value": "Mae", "variants": ["fem"] },
    { "value": "Josephine", "variants": ["fem"] },
    { "value": "Cora", "variants": ["fem"] },
    { "value": "Edith", "variants": ["fem"] },
    { "value": "Ida", "variants": ["fem"] },
    { "value": "Mabel", "variants": ["fem"] },
    { "value": "Sadie", "variants": ["fem"] },
    { "value": "Winnie", "variants": ["fem"] }
  ]
}
